{
  "schemaVersion": "1.0.0",
  "tenantId": "tenant.local",
  "generatedAt": "2026-04-24T12:00:00Z",
  "summary": {
    "totalSourceCount": 1,
    "dueSoonCount": 1,
    "overdueCount": 0,
    "ownerlessCount": 0,
    "openRefreshWorkCount": 1
  },
  "items": [
    {
      "sourceId": "src.community.acquired.pneumonia.primary-guidance",
      "sourceLabel": "ATS/IDSA CAP guideline",
      "canonicalDiseaseName": "Community-acquired pneumonia",
      "primaryOwnerRole": "Primary Care Clinical Reviewer",
      "backupOwnerRole": "Infectious Disease Editor",
      "freshnessState": "aging",
      "nextReviewDueAt": "2026-05-20T00:00:00Z",
      "daysUntilDue": 26,
      "bucket": "due-30-days",
      "openRefreshWorkItemIds": ["wrk.local.001"]
    }
  ]
}
